categories,keywords,title,link,author,pubDate,img_src,text
['스포츠'],"['2m29', '금메달', '우상혁', '올림픽', '도전', '구미', '팬', '2m33', '높이뛰기', '2025아시아육상경기선수권대회']","이미 금메달 확정에 시간은 자정 향해가는데 '또 뛴다'?…""같이 즐겨요"" 우상혁의 행복 점프",https://news.jtbc.co.kr/article/NB12248530,['이예원'],"Fri, 30 May 2025 10:48:27 +0900",https://thumb.jtbc.co.kr/photo/r600x0/etc/2025/05/30/20250530104439400001.png,"한국 높이뛰기 '간판' 우상혁 선수가 29일 경북 구미시민운동장에서 열린 2025 아시아육상경기선수권 결선에서 2m29를 뛰어 우승했습니다. 폭우 탓에 경기가 지연돼 우상혁은 자정 가까이까지 대회를 치러야했습니다. 우상혁은 이미 금메달을 확정한 뒤에도 멈추지 않고 4cm 높여 도전을 이어갔습니다. 자신을 보러 먼 길을 와준 팬들을 생각했다고 말했습니다.\n그 현장을 영상으로 전해드립니다.\n[남자 높이뛰기 결선/\n2025 구미아시아육상경기선수권대회 (29일)]\n천둥 번개 동반한 폭우에\n경기는 지연 또 지연...\n당초 오후 5시 40분에 시작해야 했지만\n우상혁은 밤 10시 10분에야 '첫 점프'\n2m15에 이어 2m19까지\n가볍게 '펄쩍'\n메달권 결정짓는 2m23\n역시 한 방에 성공\n""와아!!!""\n""대한민국! 대한민국!""\n드디어 나온 '호응 유도'\n이번에도 실패 없이 성공하고선\n'활짝'\n어느덧 다른 선수들은 탈락, 탈락...\n남은건 우상혁과 일본의 신노 도모히로\n신노가 먼저 2m29에 도전했지만...\n1차, 2차, 3차 모두 실패\n그래도 관중들은 따뜻한 박수를...\n오늘의 주인공 우상혁은?\n1차 시도에 바로 성공\n통산 3번째이자 아시아선수권 2연패\n올해 국제대회 5연속 우승까지 달성\n그런데 우상혁이 떠나지 않는다?\n이미 금메달 확정인데\n다시 겉옷 벗어던지고 출발선에...\n4cm나 높인 2m33 뛰겠다는 것\n시즌 최고 2m31도 뛰어넘는 높이\n아쉽게 넘진 못했지만\n자정을 향해가는 이 순간,\n모두 자리를 떠나지 않고\n'챔피언의 품격'에 감탄을...\n도전의 이유는 간단했다\n[우상혁/ 용인시청]\n""한국에서 열리는 국제대회인 만큼 축제잖아요?\n더 같이 즐기고 싶었습니다.""\n경기가 지연될 땐\n관중석을 봤다고\n""저 멀리 많은 분들이 그래도 앉아계시더라고요.\n거기서 진짜 '나도 포기할 수 없다'.""\n2020 도쿄 올림픽에서 2m35로 4위,\n2022 세계실내선수권도 우승했지만\n2024 파리 올림픽에서 2m27로\n7위로 마감한 우상혁\n그때 흘렸던 '뜨거운 눈물'은\n그를 더욱 강하게 만들었다\n""다른 선수 의식하지 말고, 그냥 제가 열심히 진짜\n작년 올림픽 이후로 쉼없이 달려왔어요. 달려온 것만 하자.""\n자신을 이 순간 가장 '행복한 선수'라고...\n""제가 이렇게 과분한 사랑을 받아도 되나...\n저는 진짜 너무 운이 좋은 것 같아요."""
['정치'],"['엘리트', '김문수', '노동자', '여성', '유시민', '노동인권', '여성혐오', '학력', '설난영', '권영국']","권영국, 유시민 '설난영 발언'에 “노동자 멸시, 엘리트주의 느껴져”",https://news.jtbc.co.kr/article/NB12248575,['송지혜'],"Fri, 30 May 2025 15:39:08 +0900",https://photo.jtbc.co.kr/news/jam_photo/202505/30/b8a2256c-9cd1-4c95-ac89-442cbb5df8e5.jpg,"민주노동당 권영국 대선 후보는 김문수 국민의힘 대선 후보의 배우자 설난영 여사에 대한 유시민 전 노무현재단 이사장의 최근 발언을 두고 “노동자에 대한 멸시와 엘리트주의”라고 비판했습니다.\n권 후보는 오늘(30일) 성명을 내고 “노동자들을 무지한 존재, 열등한 존재로 바라보고 있음을 느낄 수밖에 없다”며 이같이 밝혔습니다.\n앞서 유 전 이사장은 지난 28일 유튜브 채널 '김어준의 다스뵈이다'에 출연해 “유력 정당의 대통령 후보 배우자라는 자리가 설난영 씨의 인생에서는 갈 수 없는 자리다. 그래서 이 사람이 지금 발이 공중에 떠 있다. (김 후보가) 대통령 될 가능성은 제로다. (하지만) 본인은 그렇게 생각하지 않는 거다. 그러니까 '제정신이 아니다'라는 그런 뜻“이라고 말해 논란을 일으켰습니다.\n유 전 이사장은 또 “대학생 출신 노동자로서 '찐 노동자'하고 혼인한 것”이라며 “(설씨가) 그런 남자와의 혼인을 통해서 '내가 조금 더 고양되었고', 그렇게 느낄 수 있다. 자기 남편에 대해 비판적으로 보기 어렵다”라고도 했습니다.\n권 후보는 “유시민 씨에게 여성을 노동운동의 조연으로 치부할 자격은 없다. 이는 여성을 주체적이지 않고 판단 능력조차 없는 존재로 조롱하는 것일 뿐”이라며 “이는 설난영에 대한 비판이 아니라, 여성 일반에 대한 힐난이고 여성혐오 발언”이라고 지적했습니다.\n그는 “우리 사회의 노동인권은 '대학 못 간, 여성, 노동자'들이 투쟁해 쟁취해온 것”이라며 “반면 서울대 나온 엘리트 남성들은 사회를 망쳐온 것에 반성해야 한다”고 주장했습니다.\n이어 “유시민 씨가 자신의 실언에 대해 진심으로 사과하시길 권고한다”고 덧붙였습니다.\n앞서 여성단체 한국여성의전화도 “노동자는 '유력한 정당의 대통령 후보 배우자'가 될 수 없는 존재인가” 묻고, 여성ㆍ노동자에 대한 멸시와 학력 비하가 우스갯소리로 소비된 현실에 분노한다며 사과를 촉구했습니다."
['정치'],"['엄정처벌', '대리투표', '중앙선거관리위원회', '공직선거법위반', '사전투표', '공무원', '선거범죄', '선거사무원', '투표용지발급', '신분증위조']","선관위, '배우자 신분증으로 대리투표' 선거사무원 고발",https://news.jtbc.co.kr/article/NB12248565,['이지현'],"Fri, 30 May 2025 14:53:49 +0900",https://photo.jtbc.co.kr/news/jam_photo/202505/30/3014a5e6-46cd-406a-ac60-5f29872f0339.jpg,"중앙선거관리위원회가 배우자 신분증으로 대리투표를 한 사전투표 선거사무원을 오늘(30일) 공직선거법 위반 혐의로 고발했습니다.\n지방자치단체 소속 공무원인 A씨는 서울 강남구 대치동 한 사전투표소에서 투표용지발급기 운영 업무를 담당했습니다.\nA씨는 어제(29일) 낮 12시쯤 배우자 신분증으로 사전투표용지를 발급해 대리 투표를 한 뒤, 오후 5시쯤 본인의 신분증을 이용해 재차 투표를 한 혐의를 받고 있습니다.\n공직선거법 제248조 제1항에 따르면 성명을 사칭하거나 신분증명서를 위조·변조해 사용하거나 기타 사위의 방법으로 투표하거나 하게 하거나 또는 투표를 하려고 한 자는 5년 이하 징역 또는 1000만원 이하 벌금에 처하도록 규정하고 있습니다.\n또 제2항은 선거사무에 관계있는 공무원이 제1항에 규정된 행위를 하거나 하게 한 때에는 7년 이하 징역에 처하도록 규정하고 있습니다.\n선관위는 ""제21대 대통령선거를 엄중하고 공정하게 관리해야 할 사전투표 사무원이 투표용지 발급업무를 담당하는 기회를 이용해 대리투표를 했다""며 ""이 행위는 선거 행정에 대한 국민의 신뢰를 무참히 짓밟아버리는 매우 중대한 선거범죄""라고 밝혔습니다.\n그러면서 ""엄정한 처벌이 필요하다""고 강조했습니다.\n한편 선관위는 A씨가 사전투표 절차를 방해할 목적으로 배우자와 공모했는지 확인하기 위해 A씨 배우자에 대해서도 수사를 의뢰했습니다."
['사회'],"['직장내괴롭힘', '근로자', '점주', '개인사업주', '고용노동부', '백종원', '근로기준법', '술자리면접', '더본코리아', '예산시장활성화사업']","더본코리아 '술자리 면접'...노동부 ""직장 내 괴롭힘 아니다"" 이유는?",https://news.jtbc.co.kr/article/NB12248568,['이한길'],"Fri, 30 May 2025 15:13:30 +0900",https://photo.jtbc.co.kr/news/jam_photo/202505/30/3c66dd90-ea06-41c4-9c9a-5e796caa9333.jpg,"고용노동부가 더본코리아의 '술자리 면접' 논란과 관련해 해당 사건이 직장 내 괴롭힘에 해당하지 않는다고 결론 내렸습니다.\n피해자가 근로기준법상 근로자에 해당하지 않는다고 봤기 때문입니다.\n더본코리아는 백종원 씨가 대표로 있는 요식업체입니다.\n지난 2023년 더본코리아 소속 A부장은 2차 면접이라며 점주 모집에 지원한 여성 B씨를 술자리에 불러낸 뒤 부적절한 발언을 한 것으로 전해졌습니다.\n[A부장/더본코리아 직원 (JTBC '사건반장') : 갑자기 술 먹자 해서 이상하실 수 있는데…한잔하시죠, 천천히 드세요. 지금 남자 친구 없으세요? 남자 친구 있으면 안 되는데…]\nB씨는 최종 합격한 점주들과 술자리에서도 A 부장이 불쾌한 신체 접촉을 시도했다고 주장했습니다.\n사건을 조사한 고용노동부 천안지청은 피해자가 더본코리아가 진행한 예산시장 활성화 사업에 지원했고, 실제 개인 사업주로 점포를 운영하는 등 근로기준법상 근로자에 해당하지 않아 사건을 종결했다고 밝혔습니다.\n더본코리아 측은 ""해당 직원은 즉시 업무 배제 및 대기발령 조치를 시켰다. 현 사안에 대해 매우 엄중하게 바라보고 있다""고 밝혔습니다."
['사회'],"['도박', '체포', '노인', '경찰', '혐의', '현금', '청주중앙공원', '상금', '도박판', '윷놀이']",윷놀이 도박판 된 '송혜교 바둑 두던 그 공원'...5명 현행범 체포,https://news.jtbc.co.kr/article/NB12248566,['정영재'],"Fri, 30 May 2025 14:56:32 +0900",https://thumb.jtbc.co.kr/photo/r600x0/etc/2025/05/30/20250530145535660001.png,노인들이 공원에 삼삼오오 모여 있습니다.\n한 노인이 윷가락을 던집니다.\n앉아 있던 다른 남성이 말을 옮깁니다\n윷을 던진 남성이 주머니에서 현금을 꺼내 건넵니다.\n다른 남성도 지갑에서 현금 뭉치를 꺼내 건네고 윷가락을 던집니다.\n남성은 태연하게 앉아 현금을 셉니다.\n충북 청주 중앙공원에서 윷놀이 도박판이 벌어진 겁니다.\n청주 중앙공원은 넷플릭스 드라마 '더글로리'에서 배우 송혜교가 바둑 과외를 받던 장소로 알려져 유명세를 탔습니다.\n하지만 유명세를 얻기 전부터 도박판이 벌어지던 곳이었습니다.\n70대 남성 등 2명이 윷가락과 윷판을 챙겨와 도박판을 열었습니다.\n3명을 끌어들였고 대신 말을 놔주며 상금의 10%를 챙겼습니다.\n걸린 판돈만 110만원이었습니다.\n경찰은 이들 5명을 도박장을 열고 도박을 한 혐의로 현행범 체포했습니다.\n붙잡힌 70대 남성은 5월 초부터 이곳에서 도박장을 열었던 것으로 조사됐습니다.
['국제'],"['주40시간근무', '에이비아마켓', '항공기회사', '제리', '채용', '비서', '공고', '고양이', '런던']","“주 40시간, 시급 19만원""…'고양이 비서직' 지원 폭주",https://news.jtbc.co.kr/article/NB12248572,[],"Fri, 30 May 2025 15:35:35 +0900",https://thumb.jtbc.co.kr/photo/r600x0/etc/2025/05/30/20250530153506019001.png,"런던 소재 항공기 회사 '에이비아마켓'에서 고양이 비서직 채용 공고를 올려 화제입니다. 주 40시간 근무에 시급은 최대 19만원, 업무는 쓰다듬기 등이 있습니다. 지원서만 벌써 250장이 넘었다고 합니다.\n주 40시간 근무\n시급 최대 19만원\n업무는…\n우유와 사료 제공하기\n쓰다듬어 주기\n금요일마다 클래식 음악 틀어주기 등\n어떤 직업이길래?\n[데니스/'에이비아마켓' 인사팀]\n""우리 팀의 특별한 구성원을 돌봐 줄 헌신적이고 믿음직한 고양이 집사를 구합니다.""\n런던 항공기 회사 '에이비아마켓' CEO의\n고양이 '제리' 비서직 채용 공고\n지원서만 250장 넘어 '폭주'\n과연 행운의 주인공은 누구?\n임민규 인턴기자 (lim.mingyu@jtbc.co.kr)"
['국제'],"['식품안전', '네덜란드', '대마성분', '소비자신고', '해피콜라피즈', '하리보', '젤리', '제품회수', '전량회수']",그래서 CF가 그랬나?…하리보 젤리 '대마성분 검출',https://news.jtbc.co.kr/article/NB12248569,[],"Fri, 30 May 2025 15:33:36 +0900",https://thumb.jtbc.co.kr/photo/r600x0/etc/2025/05/30/20250530153309040001.png,"한국에서 귀여운 더빙 광고로 유명했던 하리보 젤리에서 대마성분이 검출됐습니다. 문제가 된 제품은 네덜란드에서 판매된 '해피 콜라 피즈'로, 하리보 측은 전량 회수에 나섰습니다. 대마 성분이 들어가게 된 경로는 현재 조사 중입니다.\n세계적으로 큰 인기인 하리보 젤리에서 대마성분이 검출됐습니다.\n네덜란드의 한 가족이 대마성분이 검출된 젤리를 먹고 몸이 아파 경찰에 신고한 겁니다.\n문제가 된 제품은 콜라병 모양의 '해피 콜라 피즈(Happy Cola F!ZZ)' 젤리로, 총 3봉지에서 대마 성분이 발견됐습니다.\n하리보는 결국 '해피 콜라 피즈' 제품을 전량 회수하기로 했습니다.\n대마성분이 들어가게 된 경로는 현재 조사 중인 것으로 알려졌습니다.\n임민규 인턴기자 (lim.mingyu@jtbc.co.kr)"
['문화·라이프'],"['주가', '오너리스크', '검찰', '하이브', '압수수색', '주주', '주식', '금융감독원', '방시혁', '사기적부정거래']","[이슈]하이브 '오너 리스크', 금감원·검찰 이슈에 '주주 긴장'",https://news.jtbc.co.kr/article/NB12248576,['김선우'],"Fri, 30 May 2025 15:45:11 +0900",https://photo.jtbc.co.kr/news/jam_photo/202505/30/741b4c04-e99b-4e20-8639-c0a66f698073.jpg,"하이브가 '오너 리스크'로 몸살을 앓고 있다. 덩달아 주주들의 긴장감도 높아지고 있다.\n30일 주식 장이 시작되기 전 하이브 주주 토론방은 긴장감이 맴돌았다. '오늘 얼마나 빠질까' '오늘 하한가 가나'라며 우려하는 목소리가 이어졌다. 장 시작 직후 등락을 반복하며 주가가 요동쳤다.\n이 모든 건 하이브와 방시혁 의장이 금융감독원(이하 금감원) 및 검찰·경찰의 주목을 받고 있기 때문이다. 각각 사안은 별개이지만 결국 상장사인만큼, 주가와 연관돼있고 이 사건들로 인해 현재 하이브 주가도 타격을 입었다.\n먼저 지난 29일 금감원이 방 의장에 대한 '사기적 부정거래' 혐의를 조사 중이라는 소식이 전해졌다. 방시혁은 2020년 하이브를 상장하기 전 지인이 설립한 사모펀드와 지분 매각 차익의 30%를 공유하기로 계약을 맺고, 상장 이후 4000억원가량을 정산받은 것으로 알려졌다. 이 계약은 증권신고서에 기재되지 않았다.\n해당 사모펀드는 기관투자자, 벤처캐피털(VC) 등 기존 투자자로부터 하이브 주식을 사들였다. 금감원은 방 의장이 2019년 기존 투자자들에게 현재 상장이 불가능하다고 전달하면서 지정감사를 신청하는 등 IPO를 추진하고 있었다는 정황을 확보한 것으로 알려졌다.\n방 의장이 사기적 부정거래 혐의로 금융감독원 조사를 받고 있다는 소식에 29일 하이브 주가는 2%대 하락했다. 하이브 주가는 장 초반 6.99%까지 급락세를 보이다가 2.51% 내린 27만 2000원으로 거래를 마쳤다.\n주주들은 '생각보단 방어했다'며 놀란 가슴을 쓸어내렸지만 끝이 아니었다. 장 마감 후 최근 하이브가 검찰의 압수수색을 받았다는 사실도 드러났다. 이에 대해 30일 하이브는 '퇴사한 한 직원의 행위에 대한 수사 당국의 자료 제공 요청에 협조한 것'이라고 밝혔다. 이미 퇴사한 전 임원 A씨는 재직 당시인 2021년 1월 하이브(당시 빅히트 엔터테인먼트)가 YG플러스에 투자할 것이라는 정보를 미리 알고 YG플러스 주식을 사들여 2억 4000만원의 이득을 취득한 혐의를 받는다.\n설상가상 하이브가 방시혁의 '사기적 부정거래' 등 혐의로 인해 또 다시 압수수색될 가능성도 있다. 경찰이 하이브 등에 대해 압수수색 영장을 신청한 상태다. 경찰은 지난달 30일에도 영장을 신청했지만 검찰이 반려하자 재신청한 것으로 전해진다. 수사계에 정통한 한 관계자는 “경찰의 강한 수사 의지를 읽을 수 있는 대목이다. 첫 압수수색 신청이 반려됐더라도 이후 혐의점이 있고 객관적인 증거가 있으면 압수수색이 받아들여질 가능성이 크다”고 내다봤다.\n하이브로썬 연이은 악재다. 이미 방시혁은 내달 20일 열리는 카카오 창업자 김범수의 카카오 시세 조정 의혹 관련 공판에 증인으로 소환 요청을 받은 상황이다. 한 사건에 언급이 됐다는 것만으로도 하이브는 부담스러운 상황. 증인의 경우 출석 의무가 있지만 강제성은 없기에 방 의장이 직접 모습을 드러낼지 주목된다. 불출석시 벌금이 불과될 예정이다.\n이처럼 바람잘 날 없이 하이브의 '오너 리스크'가 계속되고 있다. 주가에도 고스란히 반영됐다. 하이브 주가는 이날 오후 26만3000원까지도 급락했지만, 소폭 회복해 전날 대비 2.21% 하락한 26만6000원에 마감됐다. 한 하이브 주주는 '대주주 리스크는 주식 최대의 악재'라며 우려했다. 하이브 주주들은 압수수색 영장의 발부 혹시 기각 등 여러가지 시나리오를 펼치며 주가의 전망을 분석하고 있는 모양새다. 주주들은 '방시혁에게 모든 운명이 걸렸다'면서도 여전히 방탄소년단 완전체 복귀에 대한 기대감이 공존하는 분위기다.\n29일 하이브는 중국법인 설립의 소식을 전하며 한한령 해제에 대한 기대감을 드러내기도 했다. 평소 같았다면 주가에 호재였을 소식이지만, 때 아닌 오너 리스크가 겹치면서 상대적으로 빛을 보지 못했다. 한 업계 관계자는 “물론 상장사에게 주가가 중요한 요소지만, 엔터업은 대중을 상대로 하는 산업이라 상업적인 가치만큼 기업의 이미지도 매우 중요하다. 계속해서 오너 리스크가 이어질 경우 이미지 타격이 불가피할 것”이라고 전했다.\n김선우 엔터뉴스팀 기자 kim.sunwoo@jtbc.co.kr\n사진=하이브, JTBC엔터뉴스"
['문화·라이프'],"['최저가', '전국민', '초특가퀴즈쇼', '웹예능', '퀴즈', '미니건조기', '혜택', 'JTBC', '크리에이터', '팀워크']","'초특가퀴즈쇼' 찰스엔터-준빵조교-킹키-권또또, 대세 조합 속 케미 폭발!",https://news.jtbc.co.kr/article/NB12248563,[],"Fri, 30 May 2025 15:17:16 +0900",https://photo.jtbc.co.kr/news/cms/etc/2025/05/30/20250530143907765001.jpg,"오늘(30일) 저녁 6시에 공개되는 JTBC 웹예능 '초특가퀴즈쇼'는 브랜드 관련 퀴즈를 통해 전 국민 최저가 혜택을 지켜내는 '본격 최저가 사수 퀴즈쇼'다. 지난 1회에서는 첫 만남임에도 불구하고 놀라운 팀워크를 발휘하며 단백질 쉐이크 최저가를 성공적으로 사수한 가운데, 이번에는 미니건조기 최저가 혜택에 도전해 기대를 모은다.\n이날 방송에서는 대세 크리에이터 4인방의 유쾌한 '찐친 케미'가 빛을 발한다. 이들은 각자 취향이 담긴 잠옷과 각종 소품을 착용한 채로 등장해 시선을 사로잡는다. 이에 찰스엔터는 ""편한 복장이라고 해서, 우리끼리 단톡방에서 맞췄다"", ""우리 개그 동아리 같다""며 자랑스러워하고, 준빵조교는 ""아무도 시킨 적 없는데, 잠옷에 머리핀까지 하고 온 건 진짜 어이없다""며 웃음을 터뜨린다. 이어지는 퀴즈에서도 환상의 팀워크를 발휘해 문제를 풀어나가며, 한층 깊어진 케미를 뽐낸다.\n이어 크리에이터 4인방은 초특가 혜택을 지켜내기 위해 상상 이상의 과몰입을 보여준다. 이들은 전 국민 혜택이 걸렸다는 부담감에 퀴즈 시작 전부터 제작진을 의심하고, 촬영장 곳곳을 수색하며 수상한 단서를 찾아 나선다. 급기야 촬영장 한편에 설치된 건조기까지 여는 등 탐정 못지않은 집념을 발휘해 제작진을 당황케 한다. 과연 이들의 활약이 두 번째 최저가 사수로 이어질 수 있을지 귀추가 주목된다.\n점점 '한 팀'이 되어가는 크리에이터 4인방의 유쾌한 고군분투, JTBC '초특가퀴즈쇼'는 오늘(30일) 저녁 6시, 유튜브 채널 '초특가퀴즈쇼'에서 만나볼 수 있다."
['문화·라이프'],"['티켓예매', 'YES24', '공식팬카페', '박보검', '글로벌', '투어', '팬미팅', '장충체육관']","'대세' 박보검, 2년 만의 단독 팬미팅 개최",https://news.jtbc.co.kr/article/NB12248567,['유지혜'],"Fri, 30 May 2025 15:06:24 +0900",https://photo.jtbc.co.kr/news/jam_photo/202505/30/c6063d70-5cf3-4b92-ba72-a7d5347f674e.jpg,"배우 박보검이 2년 만에 단독 팬미팅을 개최한다.\n소속사 더블랙레이블은 30일 공식 SNS 채널에 박보검의 단독 팬미팅 '박보검 2025 팬미팅 투어-비 위드 유'(PARK BO GUM 2025 FAN MEETING TOUR [BE WITH YOU]) 메인 포스터를 공개했다.\n공개된 메인 포스터에는 2년 만에 개최되는 단독 팬미팅의 국내 공연 일정과 더불어 화사한 미소로 주변을 밝히는 박보검의 모습이 담겨 눈길을 끈다. 앞서 박보검은 네 차례의 티징 포스터 공개를 통해 팬미팅 개최에 대한 기대감을 키웠고, 메인 포스터에서 드디어 베일을 벗은 박보검의 눈부신 비주얼이 팬들의 환호성을 자아낸다.\n박보검은 오는 8월 1일과 2일 서울 중구 장충체육관에서 국내 팬미팅을 개최해 변함없는 지지와 응원을 보내 준 팬들을 위한 특별한 만남의 장을 마련한다. 평소 깊은 팬 사랑과 센스 있는 진행 능력, 감미로운 음색과 가창력으로 늘 색다른 무대를 완성한 만큼 이번 단독 팬미팅도 큰 기대를 모은다.\n또한 7월 26일과 27일 요코하마, 8월 14일 싱가포르, 8월 17일 가오슝, 8월 22일 마닐라, 8월 24일 방콕, 8월 29일 홍콩, 8월 31일 자카르타, 9월 6일과 13일 쿠알라룸푸르 등 글로벌 팬미팅 투어 일정도 함께 공개됐다. 그동안 수많은 작품 활동을 통해 전 세계적인 사랑을 받은 박보검은 이번 단독 팬미팅을 통해 팬들과의 거리를 더욱 좁힐 예정이다.\n공연 티켓은 YES24티켓을 통해 예매할 수 있다. 6월 11일 오후 7시 오픈되는 선예매 티켓은 박보검 공식 팬카페 가입자 중 일정 기준을 충족한 사람에 한해 구매 가능하며, 일반 예매는 6월 12일 오후 7시에 오픈된다.\n유지혜 엔터뉴스팀 기자 yu.jihye1@hll.kr\n사진=더블랙레이블 제공"
