categories,keywords,title,link,author,pubDate,img_src,text
['정치'],"['공급', '이재명', '부동산', '경제', '투자', '정책', '집값', '수요', '안정', '세금']","이재명 ""세금으로 집값 안 잡는다…전 민주 정부와 다를 것""",https://news.jtbc.co.kr/article/NB12248332,['한류경'],"Wed, 28 May 2025 23:06:27 +0900",https://photo.jtbc.co.kr/news/jam_photo/202505/28/320c27bf-e1fd-4bc5-8280-e86f70314908.jpg,"이재명 더불어민주당 대선 후보는 ""세금으로 집값 잡는 일을 하지 않겠다""고 말했습니다.\n이 후보는 오늘(28일) MBC 라디오 권순표의 뉴스하이킥에 출연해 '집값이 요새 들썩인다는 얘기가 있는데 어떻게 보나'라는 질문에 ""수요 통제를 위해서 세금을 활용하는 건 기본적으로 피하는 게 좋겠다""며 이같이 밝혔습니다.\n이 후보는 ""민주당이 집권할 가능성이 많으니까, 집값이 오를 거니까 집을 사자 그런다고 한다. 그것도 일리가 있다""며 ""(지금까지) 현상으로는 맞는 것 같다""고 말했습니다.\n그는 ""왜 그럴까 생각을 참 많이 해봤는데 일부 분석가들에 의하면 부동산이 움직일 때 수요와 공급이 작동하는 것인데, 이럴 때 수요를 억제하려고 하면 풍선효과가 생긴다는 것""이라며 ""일반적인 원리로 이럴 때는 공급을 늘려야 한다""고 설명했습니다.\n이어 ""진보 정권은 기본적으로 수요 억제 정책을 했다""며 ""세금을 부과한다든지 소유를 제한한다든지 저도 그런 생각을 많이 했었다. 근데 이걸 수요, 시장이 이겨내는 것""이라고 말했습니다.\n또 ""집값이 오르는 다른 이유는 투자 자산으로 기능해서 그런 것""이라며 ""대체 투자 수단으로 주식시장을 살리면 배당을 받을 수 있고 선순환이 이뤄진다. 소비가 되고 내수가 산다""고도 했습니다.\n이 후보는 ""집값은 부동산이기 때문에 경제 볼륨에 따라 역사적으로 오를 수밖에 없다""며 ""적정하게 올라줘야 하는데 이걸 억지로 누르면 반드시 튀어 오른다""고 말했습니다.\n그러면서 ""(부동산) 정책의 목표는 집값 안정""이라며 ""지금까지의 민주 정부와는 좀 다를 것""이라고 덧붙였습니다."
['정치'],"['국회윤리위원회', '허위사실공표', '이재명후보', '이준석후보', '공직선거법위반', '여성혐오', '징계안', 'TV토론', '혐오발언', '성평등']","민주, ""혐오 발언"" 이준석 고발…국힘 ""이재명 아들 벌금, 수치심 유발""",https://news.jtbc.co.kr/article/NB12248321,['박지윤'],"Wed, 28 May 2025 21:32:28 +0900",https://photo.jtbc.co.kr/news/jam_photo/202505/28/b0fe5dbd-a016-4b09-8a34-b1fe6c4814a7.jpg,"더불어민주당이 지난 27일 대선 후보 마지막 TV 토론에서 여성 신체에 대해 폭력적인 표현을 사용한 개혁신당 이준석 대선 후보를 공직선거법 위반 혐의로 경찰에 고발했습니다.\n민주당 선거대책위원회 공명선거법률지원단은 오늘(28일) 보도자료를 통해 ""이재명 후보 및 그 가족 그리고 모든 유권자를 향한 혐오발언이며 매우 중대한 공직선거법 위반 행위""라고 밝혔습니다.\n이어 ""이준석 후보는 이재명 후보를 낙선시킬 목적으로 허위 사실을 악의적으로 공표했다""며 ""공익적 목적이 아닌, 방송을 통해 공연히 허위 사실로 이재명 후보 또는 후보자 가족을 깎아내리거나 헐뜯기 위한 것임이 명백하다""고 덧붙였습니다.\n같은 날 민주당과 조국혁신당, 진보당, 기본소득당, 사회민주당 소속 의원 21명은 이준석 후보에 대한 징계안을 국회 윤리위원회에 제출했습니다.\n의원들은 징계안에서 ""정치는 폭력과 혐오 위에 설 수 없고, 국회의원에게는 사회를 통합해야 할 책무가 있다""면서 ""국회의원 이준석의 발언을 용인하면 대한민국의 성평등·인권 존중 사회는 바로 설 수가 없다""고 비판했습니다.\n이준석 후보는 전날 TV토론에서 민주노동당 권영국 후보에게 이재명 후보 가족과 관련해 온라인에서 제기된 주장 일부를 언급하며 ""민주노동당 기준으로, 여성 혐오에 해당하느냐""고 질문했습니다.\n질문에는 여성 신체를 대상으로 한 노골적이고 폭력적인 표현이 담겼고, 권 후보는 즉답을 피했습니다.\n이에 오늘(28일) 이준석 후보는 페이스북에 ""약식으로 벌금 500만원형을 받은 이재명 후보 아들의 공소장이 국회에 제출된 모양""이라며 ""문제의 발언이 사실로 드러나는 모양새""라고 썼습니다.\n이어 ""하루 정도 메신저 공격으로 잘 버티셨다""며 ""이재명 후보의 빠른 사과를 기대한다""고 말했습니다.\n한편 국민의힘 김혜지 수석부대변인은 오늘 논평에서 ""언론보도에 따르면, 이재명 후보의 장남 이 씨가 상습도박과 음란문언 전시 혐의로 500만원의 벌금형을 확정받았다""며 ""차마 입에 담기 어려울 정도로 노골적인 성적 대상화이자, 깊은 성적 수치심을 유발하는 발언이었다""고 지적했습니다.\n그러면서 ""(이재명 후보의) 침묵은 여성뿐 아니라 모든 국민에게 깊은 실망과 불신을 안기고 있으며, 이 후보가 내세운 여성 인권의 진정성마저 의심할 수밖에 없다""고 비난했습니다."
