categories,keywords,title,link,author,pubDate,img_src,text
"['문화·라이프', '정치']","['멤버', '개인활동', '재계약', '레드벨벳', '아이린&슬기', 'SM엔터테인먼트', '솔로앨범', '계약', '그룹활동', '유닛']","[피플]'새 막' 연 레드벨벳, 따로 또 함께 만들어갈 '균형'",https://news.jtbc.co.kr/article/NB12248268,['정하은'],"Wed, 28 May 2025 16:43:00 +0900",https://photo.jtbc.co.kr/news/jam_photo/202505/28/89c8a09b-eecc-4f21-9b65-47a0b98bda8a.jpg,"올해로 데뷔 11주년을 맞은 레드벨벳(Red Velvet)이 분기점을 맞았다. 팀 활동 재정비를 위한 숨 고르기에 들어간 이들은 각자의 자리에서 새로운 팀의 2막을 준비 중이다.\n최근 멤버 웬디와 예리가 데뷔 때부터 몸담았던 SM엔터테인먼트(이하 SM)를 떠나 새 출발을 알렸다. 2023년 8월 슬기가, 지난해 2월 아이린, 지난 1월 조이가 차례로 재계약을 알렸다. 웬디는 그룹 프로미스나인이 속한 신생 기획사 어센드와 손잡았다. 예리는 본명인 김예림으로 주지훈, 천우희 등이 속한 블리츠웨이엔터테인먼트와 계약을 체결하며 배우로서 행보를 예고했다.\n새로운 도전을 선택한 웬디와 예리는 당분간 개인 활동을 활발하게 펼칠 것으로 예상된다. SBS 파워FM '웬디의 영스트리트' DJ로 활약 중인 웬디는 새 소속사에서 솔로 앨범 등 다양한 행보를 이어나갈 예정이다. 2021년 tvN 드라마 스테이지 '민트컨디션'를 통해 배우로 데뷔한 예리는 웹드라마 '블루버스데이', KBS1 '갈채' 등에 출연했다. 2023년 넷플릭스 등 OTT에 공개된 드라마 '청담국제고등학교'에서 배우로서 잠재력을 인정받았다. 올해 개봉 예정인 영화 '넥스트'로 스크린 데뷔도 앞두고 있다.\nSM과 동행을 이어가기로 한 세 멤버는 팀이 변화를 맞은 후 각자의 활동에 집중하고 있다. 아이린과 슬기는 유닛 레드벨벳-아이린&슬기로 지난 26일 미니 2집 '틸트(TILT)'를 발매했다. 그간 레드벨벳으로 보여줬던 컨셉트와는 전혀 다른 시크하고 강렬한 비주얼과 음악으로 아이린&슬기 유닛만의 아이덴티티를 구축했다. 이들은 앨범 발매에 이어 6월 14~15일 전석 매진을 기록한 서울 공연을 시작으로 아시아 총 7개 지역에서 개최되는 첫 단독 콘서트 투어 '2025 아이린 & 슬기 콘서트 투어 '밸런스' 인 아시아(2025 IRENE & SEULGI Concert Tour 'BALANCE' in ASIA)'까지 전방위적 활동을 펼칠 예정이다. 조이는 각종 예능 프로그램에서 활약 중이다. 그는 SBS 'TV 동물농장'에서 MC로 고정 출연 중이며, 최근 MBC '나 혼자 산다'에 출연해 자취 6개월 차 일상을 공개하며 많은 관심을 모았다.\n2014년 8월 싱글 '행복(Happiness)'으로 데뷔한 레드벨벳은 '덤덤(Dumb Dumb)' '피카부(Peek-A-Boo)' '러시안 룰렛(Russian Roulette)' '배드 보이(Bad boy)' '필 마이 리듬(Feel My Rhythm)' 등 틀에 갇히지 않은 신선한 음악과 다양한 컨셉트를 선보여왔다. 또 '빨간 맛(Red Flavor)' '파워 업(Power Up)' '음파음파(Umpah Umpah)' '퀸덤(Queendom)' 등 굵직한 여름 히트곡을 내며 '서머퀸'으로 자리매김했다. 이들의 완전체 마지막 앨범은 지난해 6월 발매한 '코스믹(Cosmic)'이었다.\n레드벨벳은 3세대 여성 아이돌 그룹을 대표하는 팀이자 소녀시대, 에프엑스(f(x))의 뒤를 이어 SM의 색깔을 가장 잘 표현하고 발전시킨 그룹이라고 평가받는다. 10년의 여정을 지나 변곡점을 맞은 멤버들은 모두 팀에 대한 애정이 큰 덕에 레드벨벳으로의 활동은 이어가기로 결정했다. SM 역시 향후 레드벨벳 팀 활동에 대해서 '웬디와 예리는 레드벨벳 멤버로서의 그룹 활동은 당사와 함께할 예정'이라고 기대를 당부했다.\n과거엔 재계약이 아닌 소속사 이적을 선택할 경우 곧 팀의 해체를 의미했지만, 이젠 7년의 팀 활동 이후 각자의 선택을 존중하는 분위기로 바뀌고 있다. 오히려 팀에 새로운 활기를 불어넣을 수 있는 계기가 될 수 있다는 시선이 많아지고 있다. 한 가요계 관계자는 ""스케줄 합의 등 부차적인 노력이 필요하긴 하지만 회사와 멤버들의 의지가 있는 한 각자 적을 달리한 후에 그룹으로 활동을 병행하는 게 더는 어려운 일이 아니다. 멀리 봤을 때 그룹의 수명을 연장하는 선택일 수 있다""라고 말했다.\n최근 매거진 코스모폴리탄과의 인터뷰에서 아이린은 이번 앨범 '틸트'의 의미에 대해 ''기울어진'이라는 뜻인데, 기울어졌다고 해서 쓰러지는 느낌보다는 둘이서 밸런스를 맞춰가는 모습을 보여주려 했다'고 밝혔다. '따로 또 함께'의 방식으로 지키고 성장시켜 나갈 레드벨벳의 색깔에 기대와 관심이 쏠린다.\n정하은 엔터뉴스팀 기자 jeong.haeun1@hll.kr\n사진=JTBC 엔터뉴스, SM엔터테인먼트"
"['문화·라이프', '정치']","['음원', '멤버', '유아유', '데뷔', '미니앨범', '활동', '플레이리스트', '장르', '드림캐쳐', '유닛']","드림캐쳐 유닛 유아유 ""가장 나 다울 수 있는 앨범 만들고 싶었다""",https://news.jtbc.co.kr/article/NB12248267,['정하은'],"Wed, 28 May 2025 16:36:23 +0900",https://photo.jtbc.co.kr/news/jam_photo/202505/28/6c790cec-598a-4aba-85dd-df61f523631c.jpg,"드림캐쳐(DREAMCATCHER) 멤버 지유, 수아, 유현이 유닛 유아유(UAU)로 나서는 소감을 밝혔다.\n유아유는 28일 오후 6시 각종 온라인 음원사이트를 통해 첫 번째 미니앨범 '플레이리스트 #유 아 유(Playlist #You Are You)'를 공개하고 본격적인 데뷔 활동에 돌입한다. 이날 신보 발매를 앞두고 서울 강남구 일지아트홀에서 미디어 쇼케이스가 열렸다. 데뷔 8년 만에 유닛 결성을 알리며 새로운 도전에 나서는 유아유 멤버들은 “세 명이서 새로운 출발을 하니 설레기도 하고 낯설기도 하다”고 소감을 밝혔다.\n드림캐쳐는 지난 2017년 데뷔한 7인조 그룹이다. '악몽' '디스토피아' '아포칼립스' '평행세계' 등 컴백마다 독특한 세계관과 록, 메탈을 기반으로 하는 곡들로 주목받았다. 미국, 유럽, 아시아 등에서 꾸준한 투어를 개최하기도 했다. 그러나 올해 3월 멤버 한동, 다미, 가현의 전속계약이 만료되며 팀에 변화를 맞았다. 지유, 수아, 유현은 유닛 활동으로, 시연은 밴드 활동을 준비하며 활동 2막을 연다.\n유닛 활동으로 새롭게 보여주고 싶은 모습에 대해서 지유는 “꽤 긴 시간 가수로 활동해온 만큼 더 노련한 모습을 보여주고 싶었다”고 말했다. 유현은 “그간 컨셉츄얼한 모습을 많이 보여드렸다면유아유로서는 세 명이 '가장 나 다울 수 있는' 앨범을 만들고 싶었다. 그래서 알앤비, 시티팝, 댄스 장르 등 각자 좋아하는 음악들을 담으려고 했다”고 덧붙였다.\n신보 '플레이리스트 #유 아 유'는 일상 속 행복한 시간을 보내기를 희망하는 메시지를 담은 앨범이다. 사랑을 갈구하는 상대에게 자신과 속도를 맞춰 주길 바라는 마음을 표현한 '2 먼스(2 Months)'와 과거의 자신을 뒤로하고 당당한 모습으로 변화하고 싶은 심정을 담은 '애티튜드(Attitude)' 더블 타이틀 곡으로 활동한다.\n정하은 엔터뉴스팀 기자 jeong.haeun1@hll.kr\n사진=드림캐쳐컴퍼니"
"['문화·라이프', '정치']","['화보', '하퍼스바자', '임상테스트', '삶', '디이펙트', '연극', '연기', '배우', '이상희']","이상희, '하퍼스 바자' 화보 공개…우아한 카리스마",https://news.jtbc.co.kr/article/NB12248266,['박정선'],"Wed, 28 May 2025 16:35:10 +0900",https://photo.jtbc.co.kr/news/jam_photo/202505/28/d3e0001b-dc12-470b-b93d-7297a3aeec5f.jpg,"패션 매거진 '하퍼스 바자' 코리아에서 데뷔 15년 만에 연극 '디 이펙트' 무대에 선 배우 이상희와 함께한 화보를 공개했다.\n이번 화보에서 이상희는 블랙 레더 착장과 순백의 드레스를 소화하며, 우아한 카리스마를 드러냈다.\n촬영 후 이어진 인터뷰에서는 연기에 관한 진솔한 생각을 들려주었다. 영국 극작가 루시 프레블의 희곡을 바탕으로 한 연극 '디 이펙트'는 항우울제 임상 테스트에 참여한 네 명의 인물을 다루는 이야기다. 이상희는 실험을 이끄는 박사 로나 제임스 역을 맡았다.\n처음 대본을 읽었을 때의 인상을 묻자 ""각각 사각형의 꼭짓점에 있는 사람들의 이야기다. 극이 진행될수록 서로가 서로에게 영향을 주면서 변화하게 된다. 사랑에 좀 더 포커스가 된 이야기지만, 제가 느낀 건 그저 '삶'이었다. 네 사람의 삶이 서로 영향을 주고받다 결국 그 삶들이 겹쳐지는 느낌을 받았다""고 답했다.\n데뷔 이후 첫 연극 무대를 도전하게 된 계기를 묻자 ""영화가 좋아서 연기를 시작했다. 지금은 영화보다 연기 그 자체가 더 좋아졌다. 그러다 보니 무대 연기를 꼭 경험해보고 싶었다. 매체 연기는 준비할 시간이 상대적으로 많지 않으니까 그 안에서 가장 효율적인 걸 빨리 찾아야 하는데, 연극 작업은 주어진 정답 없이 계속 찾아 나가는 과정이 필요하더라”고 말했다.\n오랜 시간 다양한 현장에서 연기를 이어오며 조바심이나 불안을 극복할 수 있던 방법을 묻는 질문에는 ""배우가 할 수 있는 일은 씩씩하게 지금을 버티는 것이라 생각한다. 그렇게 버텨오신 선배님들이 지금 제가 좋아하는 곳에서 좋은 연기를 보여주고 계시고, 나 역시 그러고 싶다. 미래를 미리 불안해하면서 초조해하지 않는 것. 사실 사람인지라 자주 그런 생각이 들 때도 있지만 그것들을 밀어내고 지금 여기 발붙이는 것 자체가 씩씩한 일 같다""고 말하며 연기에 대한 깊은 애정을 드러냈다.\n'하퍼스 바자'는 매달 독립영화 및 다양한 작품에서 활약을 보여준 배우를 조명하는 액터스 체어(Actor's Chair)를 기획한다. 열세 번째 주인공인 이상희의 화보와 인터뷰는 '하퍼스 바자' 6월호를 통해 만날 수 있다.\n박정선 엔터뉴스팀 기자 park.jungsun@jtbc.co.kr"
"['문화·라이프', '정치']","['아에르엔터테인먼트', '화보', '전속계약', '프로필사진', '한승연', '연기', '드라마', '배우', '예능프로그램', '광고']","소속사 옮긴 한승연, 팔색조 매력 담긴 프로필 공개",https://news.jtbc.co.kr/article/NB12248258,['유지혜'],"Wed, 28 May 2025 15:42:08 +0900",https://photo.jtbc.co.kr/news/jam_photo/202505/28/b0d429ce-2f0d-4fc8-8492-d35caa80e77c.jpg,"배우 한승연이 새 프로필을 공개했다.\n28일 소속사 아에르 엔터테인먼트 측은 한승연의 팔색조 면모가 담긴 프로필 A컷을 여러 장 공개했다.\n공개된 사진 속 한승연은 블랙 브이넥 니트에 긴 생머리를 늘어뜨려 차분하면서도 절제된 무드로 시선을 끈다. 자연스럽게 묶은 머리에 화이트 터틀넥을 매치해 단아한 스타일링을 완벽하게 소화, 맑고 투명한 눈빛으로 청초한 분위기까지 완성했다. 캐주얼한 청재킷에 여유로운 포즈를 더해 시크하고 당당한 매력을 뽐내기도.\n소속사는 “이날 촬영장에서 한승연은 특유의 밝고 프로페셔널한 태도로 현장 분위기를 주도했다. 디테일을 놓치지 않는 꼼꼼한 모니터링과 자연스러운 포즈들로 완성도 높은 결과물을 만들어냈다”고 설명했다.\n한승연은 MBC '왔다! 장보리', JTBC '청춘시대', TVING '춘화연애담' 등 다수의 작품을 통해 연기 스펙트럼을 넓혀왔다. 티빙 오리지널 시리즈 '춘화연애담'에서 자존감 높고 자기 뜻을 밝히는 데 스스럼없는 '이지원' 역으로 분해 특유의 솔직함으로 극에 생동감을 불어넣으며 존재감을 발휘했다.\n현재 방영 중인 TV조선 '모-던인물史 미스터.리', 동아TV '보여줄게 장바구니2' 등 예능 프로그램에 출연하고 있다. 최근 스토리제이컴퍼니의 산하 레이블 아에르 엔터테인먼트와 전속 계약을 체결했다.\n유지혜 엔터뉴스팀 기자 yu.jihye1@hll.kr\n사진=아에르 엔터테인먼트 제공"
"['문화·라이프', '정치']","['기피스케줄', '갑질의혹', '비용절감', '사실관계확인', '폭싹속았수다', '엑스트라배우', '지원부족', '넷플릭스', '제작환경', '제작진']","넷플릭스 측, '폭싹 속았수다' 갑질 의혹에 “사실 관계 확인 중”",https://news.jtbc.co.kr/article/NB12248256,['박정선'],"Wed, 28 May 2025 15:15:24 +0900",https://photo.jtbc.co.kr/news/jam_photo/202505/28/fe7e0caf-5f78-4a05-b552-10ef69e6bc2e.jpg,"넷플릭스 측이 '폭싹 속았수다' 촬영장 갑질 의혹에 관해 “확인 중”이라는 입장을 전했다.\n넷플릭스 측은 28일 “넷플릭스는 한국의 제작 파트너들과 함께 더 나은 제작 환경을 조성하기 위해 지속적으로 노력하고 있다”며 “당시 상황에 대해서는 사실 관계를 확인 중이며, 확인된 내용에 대해서는 유사한 사례가 재발하지 않도록 면밀히 검토하겠다”고 밝혔다.\n최근 온라인 커뮤니티에는 '폭싹 속았수다' 촬영장에서 제작진의 갑질이 있었다는 주장이 담긴 글이 올라왔다.\n해당 글의 작성자는 '엑스트라 배우들 사이에서 '폭싹 속았수다'는 기피 스케줄로 악명이 높았다'며 '넷플릭스 작품임에도 불구하고 기본적인 지원이 전혀 없었고, 제작진은 배우 아니면 출연자들에게 돈을 쓰기 아까워 최대한 비용을 절감하는 데만 집중했다'고 주장했다.\n박정선 엔터뉴스팀 기자 park.jungsun@jtbc.co.kr"
"['문화·라이프', '정치']","['라이즈', '티켓', '음원차트', '팬클럽', '매진', '투어', 'SM엔터테인먼트', '시야제한석', '앨범', '단독콘서트']","라이즈, KSPO돔 3일 전석 매진…시야제한석도 오픈",https://news.jtbc.co.kr/article/NB12248254,['정하은'],"Wed, 28 May 2025 15:07:46 +0900",https://photo.jtbc.co.kr/news/jam_photo/202505/28/52884839-f05b-4810-9406-1ab0cbc1e5d5.jpg,"라이즈(RIIZE)가 첫 단독 콘서트 매진에 시야제한석까지 오픈한다.\n라이즈는 7월 4~6일 서울 KSPO DOME 공연으로 '2025 라이크 콘서트 투어 '라이징 라우드'(2025 RIIZE CONCERT TOUR 'RIIZING LOUD')'의 막을 올린다. 사흘 공연이 라이즈 공식 팬클럽 브리즈(BRIIZE) 멤버십 회원 대상의 선예매만으로 이미 전석 매진되어 화제를 모았다.\n소속사 SM엔터테인먼트는 팬들의 뜨거운 성원에 힘입어 라이즈는 첫 단독 콘서트 투어의 포문을 여는 서울 공연의 시야제한석을 추가 개방했다. 해당 좌석의 예매는 30일 오후 8시 멜론티켓을 통해 진행되어 다시 한번 치열한 티켓 경쟁이 펼쳐질 전망이다.\n라이즈는 지난 19일 첫 정규 앨범 '오디세이(ODYSSEY)'로 컴백, '3연속 밀리언셀러' 기록했다. 또 음원 사이트 멜론 톱 100 3위, 핫 100 1위, 애플뮤직 오늘의 톱 100 대한민국 차트 1위, 중국 QQ뮤직 디지털 앨범 판매 차트 1위, '플래티넘' 인증, 일본 라인뮤직 실시간·데일리 앨범 톱 100 1위 등 국내외 음반 및 음원 차트에서 '커리어하이'를 달성하고 있다.\n라이즈는 29일 Mnet '엠카운트다운', 30일 KBS2TV '뮤직뱅크' 및 ENA '케이팝업차트쇼', 31일 MBC '쇼! 음악중심', 6월 1일 SBS '인기가요' 등 음악 프로그램에 출연해 타이틀 곡 '플라이 업(Fly Up)' 무대를 선보인다.\n정하은 엔터뉴스팀 기자 jeong.haeun1@hll.kr\n사진=SM엔터테인먼트"
"['문화·라이프', '정치']","['게스트', '축하', '90년대스타', '결혼', '축가', '룰라', 'JTBC', '피로연', '아는형님', '이상민']",'아는 형님' 이상민 결혼 피로연 특집…'특별 게스트' 축하 무대!,https://news.jtbc.co.kr/article/NB12248250,[],"Wed, 28 May 2025 15:05:59 +0900",https://photo.jtbc.co.kr/news/cms/etc/2025/05/28/20250528143913184001.jpg,"이상민의 결혼을 축하하기 위해 특별한 게스트들이 출격한다.\n김지현, 채리나, 김진, 이지혜가 최근 혼인신고를 마친 이상민을 축하하기 위해 JTBC '아는 형님'에 출연한다. 그룹 룰라로 함께 활동했던 김지현과 채리나는 물론, 이상민이 프로듀싱했던 그룹의 멤버 김진과 이지혜가 출연해 이상민과 특별한 케미를 뽐낼 예정이다.\n이날 '아는 형님'은 이상민 결혼식 피로연 형태로 진행되며, 오랜 기간 인연을 이어온 형님들의 축가는 물론 특별 초대된 게스트들의 축하 무대가 공개된다. 이상민의 결혼을 축하하기 위한 특별한 무대와 90년대를 뜨겁게 달군 스타들의 다양한 에피소드는 6월 중 JTBC '아는 형님'에서 확인할 수 있다."
"['문화·라이프', '정치']","['SBS', '결혼', '배성재', '김다영', '방송인', '퇴사', '골때리는그녀들', '아나운서', '혼인신고', '신혼여행']","배성재, 김다영과 법적부부 됐다 “최근 신혼여행 다녀와”",https://news.jtbc.co.kr/article/NB12248246,['유지혜'],"Wed, 28 May 2025 14:34:14 +0900",https://photo.jtbc.co.kr/news/jam_photo/202505/28/32869777-944a-4a81-aee7-6892c526bcf8.jpg,"아나운서 출신 방송인 배성재(47)와 김다영이 법적부부가 됐다.\n28일 배성재 소속사 SM C&C는 “두 사람이 최근 혼인신고 후 신혼여행을 다녀왔다”고 밝혔다. SBS '골 때리는 그녀들'에서 인연을 맺은 두 사람은 2년간 교제 끝에 지난 2월 결혼을 발표했다. 예식은 생략하고 가족 식사로 대신했다.\n배성재는 지난 2월 자신이 진행하는 SBS 파워FM '배성재의 텐'에서 “김다영씨와 함께 살아가려고 한다”며 결혼 소식을 직접 전했다. 1978년생인 그는 2005년 KBS광주방송총국을 거쳐 이듬해 SBS 14기 공채 아나운서가 됐다. 스포츠 캐스터로 인기를 모으다 2021년 퇴사했다. 현재는 '골 때리는 그녀들', MBN '뛰어야 산다' 등에 출연하고 있다.\n1992년생인 김다영은 목포 MBC, 부산 MBC를 거쳐 2021년 SBS 경력직 아나운서로 입사했다. '골 때리는 그녀들' 등에 출연했고, 지난달 SBS에서 퇴사했다.\n유지혜 엔터뉴스팀 기자 yu.jihye1@hll.kr"
"['문화·라이프', '정치']","['게시물삭제', '네티즌추측', '해명', '정치적견해', '대선', '소속사대응', 'SM엔터테인먼트', '에스파카리나', 'SNS논란', '정치색']","SM, 카리나 정치색 논란에 “목적·의도 없어…오해 인지 후 게시물 삭제”",https://news.jtbc.co.kr/article/NB12248243,['박정선'],"Wed, 28 May 2025 14:23:10 +0900",https://photo.jtbc.co.kr/news/jam_photo/202505/28/c01fc912-05c3-4c66-bae4-e50f3844dace.jpg,"그룹 에스파 카리나의 SNS에서 시작된 정치색 논란에 관해 소속사 SM엔터테인먼트가 “다른 목적이나 의도는 없었다”고 해명했다.\nSM엔터테인먼트는 28일 “당사 아티스트 카리나의 게시물로 심려를 끼쳐 드린 점 사과드린다”며 “카리나는 일상적인 내용을 SNS에 게시한 것일 뿐 다른 목적이나 의도는 전혀 없었으며, 오해의 소지가 있다는 점을 인지한 후 곧바로 게시물을 삭제했다”고 전했다.\n그러면서 “본의 아니게 심려를 끼쳐드린 부분에 대해 진심으로 죄송하게 생각하고 있다”면서 “당사 또한 향후 이와 같은 일이 발생하지 않도록 더욱 주의를 기울이고 노력하겠다. 더 이상 아티스트의 뜻이 왜곡되어 특정 의도로 소비되는 일이 없기를 바라며, 당사는 카리나를 비롯한 모든 아티스트의 보호에도 최선을 다하겠다”고 강조했다.\n지난 27일 카리나는 자신의 SNS에 숫자 2가 쓰여진 붉은 무늬 재킷을 입은 사진을 공개했다. 이에 일부 네티즌은 카리나가 이번 대선과 관련해 자신의 정치적 견해를 드러낸 것이 아니냔 추측을 내놓았다. 정치권에서도 카리나를 향한 목소리가 흘러나오기도 했다.\n박정선 엔터뉴스팀 기자 park.jungsun@jtbc.co.kr"
"['문화·라이프', '정치']","['웹툰', '흥행', '액션', '학교폭력', '학원액션물', '캐릭터', '연기', '웨이브', 'ONE:하이스쿨히어로즈', '이정하']","이정하, '흥행불패' 학원 액션물로 다시 날다(종합)",https://news.jtbc.co.kr/article/NB12248240,"['박정선', '박세완']","Wed, 28 May 2025 14:05:41 +0900",https://photo.jtbc.co.kr/news/jam_photo/202505/28/4c333660-cf7b-4539-9112-b39c5e303e90.jpg,"배우 이정하가 웨이브 'ONE : 하이스쿨 히어로즈'를 통해 학원 액션물 흥행 불패 계보를 잇는다.\n28일 오전 서울 광진구 롯데시네마 건대입구에서 'ONE : 하이스쿨 히어로즈' 제작발표회가 진행됐다.\n'ONE : 하이스쿨 히어로즈'는 아버지의 억압에 시달리던 전교 1등 이정하(의겸)와 그의 천부적인 싸움 재능을 이용하려는 김도완(윤기)이 복면을 쓴 '하이스쿨 히어로즈'를 결성해 억눌린 분노를 폭발시켜 학교 폭력 서열을 뒤엎는 하이스쿨 액션 드라마다.\n카카오웹툰에서 누적 조회수 6500만 회를 기록하고 '2020년 오늘의 우리 만화상'을 수상한 웹툰 'ONE'을 원작으로 한다. '양자물리학' 이성태 감독이 연출을 맡았다.\n'무빙'을 통해 대세 배우로 자리매김한 이정하가 억눌린 싸움 본능을 각성한 전교 1등 의겸으로 분해 강렬한 연기 변신을 선보인다. 의겸의 싸움 재능을 꿰뚫어 보고 하이스쿨 히어로즈 결성을 이끄는 윤기 역의 김도완, 의겸의 아버지 김석태 역의 김상호, 의겸의 어머니 명다빈 역의 김주령, 싸움 최강자 최기수 역의 유희제, 의문의 전학생 이걸재 역의 육준서, 1학년 일진 김승준 역의 임성균과 호흡을 맞춘다.\n시청자에게 이정하의 존재감을 깊이 각인시킨 작품은 무엇보다 2023년 디즈니+를 통해 공개된 '무빙'이다. 디즈니+ 한국 오리지널 작품 가운데 최고 흥행작으로 꼽히는 '무빙'에서 이정하는 하늘을 날아다니는 초능력을 갖고 태어난 봉석을 연기했다. 캐릭터와 '착붙'인 열연으로 제60회 백상예술대상에서 TV부문 남자 신인연기상을 수상하기도 했다.\n'무빙'에서는 하늘에서 싸웠다면, 이번엔 지상이다. 이정하는 땅에 발을 딛고 서서 다양한 액션 연기로 새로운 도전에 나선다. 이에 대해 이정하는 “지상에서 싸운다. 다른 결로 신기하다. 박진감 넘치게 재미있게 촬영할 수 있었다”라고 말했다.\n강력한 액션신으로 금강불괴(금강석처럼 단단해 쉽게 부서지지 않는다는 뜻)라는 별명을 갖게 됐다는 이정하. “의겸 캐릭터 자체가 싸움에 천부적인 재능이 있다. 무술을 한번 보고 따라해서 똑똑하게 잘 이용하는 캐릭터다. 다양한 액션을 소화하려고 노력하다 보니 많은 액션신이 생겼다”면서 “안전을 우선시하는 현장이었고, 동료들이 주는 파이팅 넘치는 에너지 덕분에 그런 별명이 생겼다”고 전했다.\n많은 변화를 꾀하고 있는 이정하이지만, 변하지 않는 것은 이정하 특유의 순수한 매력이다. 순수한 매력과 함께 의겸 캐릭터의 강렬함을 더했다. 웹툰 속 캐릭터를 '이정하 화(化)'했다.\n이성테 감독은 “이정하는 천진난만하고, 얼굴 표정이 많다. 보면 사람을 기분 좋게 해준다. 이정하가 한번 웃으면 녹는다. 그런데, 이 드라마의 주인공은 억압 속에서 표정을 잃은 친구다. 한번씩 해방감을 느낄 때, 이정하의 사람을 녹이는 표정이 자연스럽게 나왔으면 했다. 이정하가 감정을 스스로 만들어내면 예쁜 눈이 무섭게 바뀐다. 그게 의겸 캐릭터를 묘사하는 데에 좋을 수 있겠다고 판단했다”고 설명했다.\n웹툰을 원작으로 한 학원 액션물은 최근 흥행 불패를 이어가고 있다. 최근 시즌2가 넷플릭스에서 공개된 시리즈 '약한영웅'은 물론, 티빙 시리즈 '스터디 그룹', 티빙에서 공개된 영화 '샤크: 더 비기닝' 등이 시청자의 사랑을 받았다. 복잡한 갈등 구조 대신 시원한 액션과 단순하면서도 흥미로운 인물 서사로 K-학원 액션물의 영역을 넓혀가고 있다.\n이런 가운데 출범한 'ONE : 하이스쿨 히어로즈'가 계보를 이어갈 수 있을지 이정하의 어깨가 무거운 상황. “웹툰을 찢고 나왔다는 말에 어깨가 올라간다”는 이정하는 “저에게 있어 새로운 도전”이라며 각오를 다졌다.\n'ONE : 하이스쿨 히어로즈'는 30일부터 웨이브를 통해 순차 공개된다.\n박정선 엔터뉴스팀 기자 park.jungsun@jtbc.co.kr\n사진=박세완 엔터뉴스팀 기자"
