categories,keywords,title,link,author,pubDate,img_src,text
['문화·라이프'],"['음악', '월드투어', '음원차트', '폭싹속았수다', '성공', '아이유', '꽃갈피셋', '연기', '배우', '리메이크앨범']","[피플]역시 아이유, 본업도 '폭싹 해냈수다'…역주행 제치고 1위",https://news.jtbc.co.kr/article/NB12248435,['김선우'],"Thu, 29 May 2025 17:24:13 +0900",https://photo.jtbc.co.kr/news/jam_photo/202505/29/64e9e912-76b3-4dc3-aaba-8298caecf2a1.jpg,"역시 아이유다. 배우에 이어 가수 아이유의 귀환도 성공적으로 해냈다.\n아이유는 지난 26일 리메이크 앨범인 '꽃갈피 셋'을 발매했다. 상반기엔 넷플릭스 '폭싹 속았수다'의 애순이로 전국민적 사랑을 받았던 그가 1년 3개월 만에 가수로 돌아왔다.\n이번 앨범에선 '네버 엔딩 스토리(Never Ending Story)' '빨간 운동화' '미인' 등 선배들의 히트곡을 리메이크했다. 아이유 신곡에 대한 리스너들의 갈증을 해소하듯, 발매 하루 만에 음원차트를 접수했다. 29일 오후 기준, 멜론에서 아이유의 '네버 엔딩 스토리'가 톱100 1위를 사수 중이다. 10cm '너에게 닿기를', 우즈 '드라우닝(Drowning)' 등 장기 흥행 중이던 역주행 곡들을 제쳤다. 50위 안에 수록곡이 전부 차트인돼 '음원 퀸'의 귀환을 알렸다.\n더욱 고무적인 건, 오직 음악으로만 승부수를 던졌다는 점이다. 보통 가수들이 컴백할 때 음악방송에 출연하고 다수 예능 및 유튜브 콘텐트로 프로모션을 하는 것과 사뭇 다른 행보다. 아이유는 별다른 홍보 없이도 음악의 힘으로 차트 정상을 탈환했다. 리메이크라는 성공공식을 썼다한들 '역시 아이유'란 이야기가 나오는 이유다.\n더구나 가수와 배우 두마리 토끼를 다 잡은 진정한 '올라운더'라는 점도 주목할 만하다. 각 분야에서 모두 정점을 찍은 아티스트는 흔치 않다. 스스로 '가수 출신 배우'라는 꼬리표도 떼고 연기력을 인정 받았다. 그 결과 '폭싹 속았수다'로 '제61회 백상예술대상'에서 방송부문 여자 최우수 연기상 후보는 물론이고, 대상 후보까지 거론될 정도로 영향력이 상당하다.\n본업인 가수 활동도 소홀히 하지 않는다. 꾸준히 신곡으로 리스너들의 마음을 어루만지고, 최근에는 월드투어도 성공적으로 끝내며 활동 반경을 세계로 넓혔다. 어느덧 18년차 베테랑임에도 끊임없이 도전하며 '커리어 하이' 중이다. 어린이날, 자신의 생일 등 기념일엔 잊지 않고 기부를 실천하며 선한 영향력마저 뽐냈다.\n가수 겸 배우 아이유, 인간 이지은에게까지 높은 신뢰감을 가질 수 밖에 없는 발자취들이다. 아이유의 하반기도 바쁘다. 신보 발매와 더불어 쉴 틈 없이 차기작 MBC 새 드라마 '21세기 대군부인'이 기다리고 있다. 변우석과의 로맨스 케미스트리도 기대감을 모은다.\n정민재 대중음악 평론가는 “아이유에게 있어서 '꽃갈피'는 의미있는 여정이었고, 아이유 역시 리메이크계에선 신뢰를 받는 브랜드”라며 “리메이크 자체가 성공을 보장하는 안전한 선택이라고 보는데, 아이유의 '꽃갈피' 프로젝트는 특히나 그렇다고 생각한다. 대중이 좋아하는 노래를 듣기 편하게 대중적인 해석으로 잘 해냈다”고 밝혔다.\n이어 “이번엔 2000년대 노래들을 많이 택했는데 이 곡을 당시에 들었던 세대들도 40대를 넘었다. 그만큼 세대를 아우를 수 있는 접근이다. 뮤지션으로서의 존재감을 다시금 드러내기 위한 성공적인 전략이 잘 통했다고 본다”며 “스타디움 공연을 할 수 있는 가수도 별로 없는데 아이유는 계속해서 전성기를 가져가고 있다”고 내다봤다.\n김선우 엔터뉴스팀 기자 kim.sunwoo@jtbc.co.kr\n사진=JTBC엔터뉴스, EDAM엔터테인먼트"
['문화·라이프'],"['복수', '차승원', '이준혁', '광장', '봉산', '소지섭', '넷플릭스', '주운', '조직', '엔클린']",소지섭부터 차승원까지…넷플릭스 '광장' 주역들의 시너지,https://news.jtbc.co.kr/article/NB12248432,['박정선'],"Thu, 29 May 2025 16:42:45 +0900",https://photo.jtbc.co.kr/news/jam_photo/202505/29/682d0395-4038-4f97-bb09-bff5b9273749.jpg,"넷플릭스(Netflix) 시리즈 '광장'이 보도스틸을 29일 공개했다.\n'광장'은 스스로 아킬레스건을 자르고 광장 세계를 떠났던 소지섭(기준)이 조직의 2인자였던 동생 이준혁(기석)의 죽음으로 11년 만에 돌아와 복수를 위해 그 배후를 파헤치는 느와르 액션 시리즈다.\n먼저, '광장' 세계의 두 조직인 봉산과 주운의 운명을 바꿔놓은 11년 전 사건의 진실 앞에 선 소지섭의 모습이 눈길을 사로잡는다. 사건 이후 광장 세계에 돌아오지 않을 것을 약속하고 스스로 아킬레스건을 끊은 채 잠적한다. 하지만 동생이자 주운 조직을 키워내 2인자의 자리까지 올랐지만 의문의 죽음을 맞이한 이준혁의 시신을 보고 있는 심각한 표정에서 엿볼 수 있듯, 그는 동생의 죽음에 얽힌 비밀을 찾기 위해 광장 세계로 다시 돌아오며 복수의 여정을 시작한다.\n'광장' 세계를 양분하고 있는 주운과 봉산 패밀리의 모습도 시선을 사로잡는다. 주운 조직의 수장 허준호(이주운)와 봉산 조직의 수장인 안길강(구봉산)이 대립하고 있는 스틸은, '누구든 상대를 건든 자는 반드시 대가를 치러야 한다'는 광장 세계의 규칙과 함께, 11년 만에 돌아온 소지섭으로 인해 두 조직이 마주할 사건들을 예고하며 이들이 그려나갈 서사에 궁금증을 더한다.\n이와 함께 안길강의 아들이자 봉산 조직의 후계자인 공명(구준모)의 스틸은 오직 자신의 욕망만을 위해 앞뒤 가리지 않는 성격을 생생하게 보여준다. 고뇌에 빠진 듯한 표정의 추영우(이금손)의 모습은 주운 조직의 수장인 허준호의 아들이자 현직 검사인 그가 광장 세계의 판도를 뒤엎기 위해 어두운 야심을 품고 예측 불가한 전개를 이끌 것임을 예감케한다.\n한편, 가장 가까운 거리에서 허준호를 수행하는 오른팔 조한철(최성철)이 누군가와 전화하는 모습은 조한철이 소지섭의 등장으로 흔들리는 조직을 수습하기 위한 과정에서 어떤 사건들을 마주할지 흥미를 유발한다. 또한, 광장 세계의 어두운 일을 뒤처리하는 엔클린의 대표 이범수(심성원)가 소지섭과 마주한 모습은 이범수가 소지섭에게 동생 이준혁의 죽음에 얽힌 어떤 단서를 제공할지 궁금증을 높인다.\n마지막으로 어딘가 불안한 눈빛의 차승원(차영도)의 스틸은 봉산과 주운 두 조직 어디에도 속하지 않는 광장 세계의 미스터리한 존재로서의 모습을 보여주며 광장 세계를 더욱 혼돈에 빠뜨릴 그의 역할에 대한 호기심을 더한다. 또한, 묵직한 눈빛과 분위기를 풍기는 소지섭의 스틸은 모든 사건에 도화선이 되는 그가 어떤 인물과 마주할지 광장 세계에 비밀스러움을 더한다.\n'광장'은 오는 6월 6일 오후 4시 넷플릭스에서 공개된다.\n박정선 엔터뉴스팀 기자 park.jungsun@jtbc.co.kr"
['문화·라이프'],"['온라인예약', '디자이어:언리시', '이벤트', '손편지', '스탬프랠리', '팝업스토어', '기념품', '앨범', '미니6집', '엔하이픈']","'컴백' 엔하이픈, 신보 발매 기념 팝업 韓·中·日 개최",https://news.jtbc.co.kr/article/NB12248429,['김선우'],"Thu, 29 May 2025 16:29:03 +0900",https://photo.jtbc.co.kr/news/jam_photo/202505/29/c282d94a-7201-4172-8a3b-cd611919f4d4.jpg,"엔하이픈(ENHYPEN)의 신보를 더욱 선명하게 느낄 수 있는 오프라인 팝업 스토어가 한국과 중국, 일본에서 문을 연다.\n29일 엔하이픈 소속사 빌리프랩에 따르면 엔하이픈(정원, 희승, 제이, 제이크, 성훈, 선우, 니키)은 내달 6일부터 12일까지 서울 용산구 아이파크몰 용산점 더 센터 6층에서 '엔하이픈 '디자이어 : 언리시' 팝업 스토어(ENHYPEN 'DESIRE : UNLEASH' POP-UP STORE)'를 진행한다. 이 팝업 스토어는 중국 베이징 서단 더뉴 B113과 광저우 패션 텐허 플라자, 일본 도쿄 타워레코드 시부야점에서도 개최된다.\n팝업 스토어에서는 미니 6집 실물 음반과 머치뿐만 아니라 다채로운 즐길거리가 준비돼 신보에 대한 몰입감 높은 경험을 안길 것으로 기대된다.\n먼저 신보 구매자에게 제공되는 엽서에 손편지를 작성하면 추첨을 통해 멤버들의 친필 답장을 받을 수 있는 손편지 이벤트가 마련됐다. 팝업 스토어 내외부에서 도장을 모아 앨범 로고 '디자이어 : 언리시(DESIRE : UNLEASH)'를 완성하는 스탬프 랠리도 기다리고 있다.\n미니 6집의 배스밤 시향 부스에서 제공되는 시향지와 완성된 스탬프 랠리 용지를 결합하면 브랜드의 색다른 기념품으로도 소장 가능하다. 또한 현장에서만 만날 수 있는 미공개 영상을 볼 수 있는 전용 공간도 마련됐다.\n이번 팝업 스토어는 온라인 사전 예약제로 운영되며, 30일 오전 11시 예약 페이지가 오픈된다. 팝업 이용과 공식 상품에 관한 상세 정보는 하이브 머치(HYBE MERCH) 공식 SNS 및 엔하이픈 위버스(Weverse) 커뮤니티에서 확인할 수 있다.\n엔하이픈은 내달 5일 오후 1시 미니 6집 '디자이어 : 언리시(DESIRE : UNLEASH)'로 컴백한다. 이 앨범은 사랑하는 너와 내가 같아지기를 바라는 욕망과 인내를 엔하이픈만의 감정으로 전달한다. 타이틀곡 '배드 디자이어(Bad Desire)(With or Without You)'는 '널 뱀파이어로 만들고 싶다'라는 지배적인 욕망을 시크한 무드로 그려낸 댄스 팝 장르의 곡이다.\n김선우 엔터뉴스팀 기자 kim.sunwoo@jtbc.co.kr\n사진=빌리프랩"
['문화·라이프'],"['로맨스', '강력특수팀', '액션', '토일극', '박보검', '이상이', '수사극', '메달리스트', '김소현', 'JTBC', '심나연감독', '굿보이']","“'굿보이', 케미 굿”…박보검·김소현·이상이 '굿벤져스' 온다(종합)",https://news.jtbc.co.kr/article/NB12248427,"['유지혜', '박세완']","Thu, 29 May 2025 16:28:04 +0900",https://photo.jtbc.co.kr/news/jam_photo/202505/29/19387276-2ef8-40be-9e43-104d9d7eae18.jpg,"배우 박보검, 김소현, 이상이, 심나연 감독 등 방송가 대표 '히트 메이커'들이 JTBC 새 토일극 '굿보이'로 뭉쳐 글로벌 히트에 도전한다.\n29일 오후 서울 구로구 더링크서울에서는 '굿보이' 제작발표회가 열렸다. 심나연 감독과 배우 박보검, 김소현, 오정세, 이상이, 허성태, 태원석이 참석했다. 31일 오후 10시 40분 첫 방송하는 '굿보이'는 특채로 경찰이 된 메달리스트들이 강력특수팀으로 모여 비양심과 반칙이 판치는 세상에 맞서 싸우는 코믹 액션 청춘 수사극이다.\n박보검과 김소현, 이상이는 각각 복싱 금메달리스트 출신 순경 윤동주, 사격 금메달리스트로 '사격 여신'으로 불리는 경장 지한나, 펜싱 은메달리스트 경사 김종현 역을 맡는다. 이들이 소속된 강력특수팀을 이끄는 레슬링 동메달리스트 출신 팀장 고만식 역은 허성태가, 그의 오른팔로는 원반던지기 동메달리스트 출신 경장 신재홍 역은 태원석이 연기한다. 오정세는 이들을 위협하는 관세청 세관 7급 공무원 민주영 역을 맡아 '빌런'으로 활약한다.\n연출은 JTBC 드라마 '괴물'로 제57회 백상예술대상 TV부문 드라마 작품상을 수상하고, '나쁜 엄마'를 글로벌 히트 시킨 심나연 감독이 맡는다. 드라마 '라이프 온 마스', '보좌관' 시리즈 등으로 수사극에 강점을 보인 이대일 작가가 의기투합해 '굿벤져스'의 활약을 유쾌하고 통쾌하게 담는다.\n배우들은 서로 다른 초능력으로 팀워크를 맞춰갔던 마블 영화 '어벤져스'의 히어로들처럼 각자의 주종목을 살려 하나의 팀으로 성장하는 과정을 생동감 있게 그린다. 그 사이에 박보검과 김소현, 이상이의 삼각 로맨스도 곁들여 성장, 로맨스, 코믹, 액션 등 다양한 장르를 절묘하게 결합시켜 폭넓은 시청자를 공략할 각오다.\n강력특수팀의 활약상은 배우들의 마음을 움직인 가장 큰 원동력이기도 했다. 박보검은 “만화책 읽는 것처럼 전개가 빠르고 재미있었다. 주특기가 운동인 경찰들이 든든해 보였다. 정의를 위해 싸우고 세상을 향해 목소리를 내는 캐릭터들이 멋있어서 꼭 작품에 함께 하고 싶었다”고 말했다. 김소현과 '빌런'으로 등장하는 오정세도 “작품 자체에 큰 매력을 느꼈다”면서 “대본에서 큰 에너지를 느낀 것이 오랜만이다”고 힘주어 말했다.\n주특기가 서로 다른 '굿벤져스'의 다채로운 액션 장면도 볼 거리다. 박보검은 권투 실력을 바탕으로 하는 '맨몸 액션', 김소현은 장총을 자유자재로 다루는 사격 액션을 선보인다. 극 중 펜싱 선수였던 이상이는 정장 차림으로 삼단봉을 검처럼 휘두르는 '삼단봉 액션'을 펼친다. 팀장 역 허성태는 “액션 장면을 글로 보는데 눈물이 났다. 그 자체가 신기한 경험이었다. 서로 다른 주특기를 가진 캐릭터들이 서로를 보호하고 싶어하는 마음이 깃든 액션이어서 눈물을 흘렸다”며 감동적인 액션 드라마가 될 것이라 자신했다.\n5인 배우들은 메달리스트 출신 캐릭터를 소화하기 위해 6개월 이상 각자 훈련에 매진했다. 부상도 이들의 열정을 막지는 못했다. 박보검은 촬영 중 다리 부상으로 한 달여 동안 일정을 쉬어야 했고, 허성태는 엄지 발톱이 빠지는 아픔을 감수하며 연기에 임했다. 박보검은 “다쳤을 때 감독님과 스태프들이 모두 잘 먹고, 잘 쉬고, 잘 관리해야 더 빨리 복귀할 수 있으니 마음 쓰지 말고 몸조리 하라고 격려해줬다. 윤동주가 극 중 회복 능력이 정말 좋은데, 동주처럼 한 달 반 만에 완벽하게 촬영장에 복귀했다. 그 이후 하루도 쉼 없이 달려 스태프들에게 정말 감사하고 죄송한 마음이 크다. 그런 고마운 마음이 화면에도 잘 드러날 것 같다”고 돌이켰다.\n특히 박보검의 변신은 드라마의 최대 관전 포인트로 통한다. 박보검은 “나이 앞자리가 '3'으로 바뀌면서 과감해졌다. 하고 싶은 것을 할 수 있을 때 다 해보자는 마음이 컸다. 지금까지 차근차근 걸어왔다면 이제는 조금씩 속도를 내서 경보의 수준으로 가기로 했다. 해보지 못했던 역할이나 장르를 찾아가며 제 자신의 한계를 깨고 영역을 넓혀가고 싶었다. 그런 마음이 들면서 '굿보이'를 하게 됐다”면서 “'굿보이'는 선을 위해 살아가는 사람들을 향한 찬사다. 5명이 정의가 아직 살아있고, 정의를 위해 살아가는 사람이 있다는 걸 보여주고 있다. 정의를 위해 뛰는 공무원 분들에게 힘이 됐으면 좋겠다”고 설명했다.\n배우들의 바람은 '작품상'이다. 이상이는 “작품에 대한 애정으로 모든 배우가 열심히 프로모션을 하고 있다. 우리 5명의 '케미'는 정말 '굿'이었다. 만에 하나 시상식에서 상을 받게 된다면 작품상을 받고 싶다고 정말 많이 이야기했다”며 스태프들을 향한 고마움을 드러냈다. 심나연 감독도 “쉽게 재미있게 볼 수 있는 드라마다. 시청자가 드라마를 볼 때 만큼은 마음 편하게 보기를 바라는 마음에서 우리는 어렵고 힘들게 촬영했다”며 드라마를 향한 애정을 드러냈다.\n유지혜 엔터뉴스팀 기자 yu.jihye1@hll.kr\n사진=박세완 엔터뉴스팀 기자"
['문화·라이프'],"['콘텐츠', '소통', '공연', '가수', '음악활동', '츄(CHUU)', 'MZ세대', '퍼포먼스', '히트곡', '대학축제']","'인간 비타민' 츄, '대학 축제 요정' 등극",https://news.jtbc.co.kr/article/NB12248426,['김선우'],"Thu, 29 May 2025 16:25:19 +0900",https://photo.jtbc.co.kr/news/jam_photo/202505/29/bf280923-7446-4189-bc88-b2bdde0479b1.jpg,"츄(CHUU)가 MZ 세대들의 지지를 받으며 '대학 축제 요정'으로 거듭났다.\n츄는 지난 14일 카이스트를 시작으로 강서대학교, 한국폴리텍대학 인천캠퍼스, 경기과학기술대학교, 한남대학교, 금오공과대학교, 중원대학교, 수원대학교 등 다수의 대학 축제 무대에 올라 관객들과 뜨겁게 호흡했다. 이밖에도 고척스카이돔에서 개최된 '이세계페스티벌 2025', '제2회 아산시 청소년페스타' 등 주요 대형 행사에서도 활약하며 존재감을 발휘하고 있다.\n무대에서 츄는 지난 4월 발매했던 미니 3집 타이틀곡 '온리 크라이 인 더 레인(Only cry in the rain)'을 비롯해 수록곡 '백 인 타운(Back in town'), '키스 어 키티(Kiss a Kitty)' 등 신곡 무대들을 선보이며 MZ세대의 감성을 완벽하게 저격했다. 뿐만 아니라, 전작 타이틀곡 '스트로베리 러시(Strawberry Rush)', 드라마 OST로 큰 사랑을 받은 '일과 이분의 일' 등 히트곡 무대도 연이어 선보이며 현장의 열기를 한층 끌어올렸다.\n무엇보다 츄는 특유의 사랑스러운 에너지는 물론, 이전보다 한층 깊어진 감성과 퍼포먼스로 관객들의 뜨거운 호응을 얻었다. 매 무대마다 탄탄한 보컬 실력과 프로페셔널한 무대 매너로 관객을 압도하며, 축제를 넘어 완성도 높은 무대를 선사했다는 호평을 받고 있다.\n츄 소속사 ATRP는 '츄가 다양한 무대를 통해 팬들과 적극적으로 소통하며 무대 위 존재감을 확고히 다지고 있다. 앞으로도 음악 활동은 물론 다채로운 콘텐트로 팬들과 만날 예정'이라고 전했다.\n츄는 앞으로도 다양한 방송 및 공연으로 활발하게 활동을 이어나갈 계획이다.\n김선우 엔터뉴스팀 기자 kim.sunwoo@jtbc.co.kr\n사진=ATRP"
['문화·라이프'],"['하이파이브', '흥행', '초능력', '코믹액션', '아이돌', '코미디', '영화', '마스크걸', 'SNL코리아', '안재홍']","안재홍 ""'SNL' 출연 후 '예쁘다' 소리 많이 들어…영화 흥행하면 안젤로 인사""",https://news.jtbc.co.kr/article/NB12248425,['조연경'],"Thu, 29 May 2025 16:24:49 +0900",https://photo.jtbc.co.kr/news/jam_photo/202505/29/ecf80ffe-f1d6-40c5-805c-9aac721ba7ca.jpg,"믿고 보는 안재홍의 코미디가 됐다.\n영화 '하이파이브(강형철 감독)' 개봉을 앞두고 있는 안재홍은 29일 서울 삼청동의 한 카페에서 진행 된 인터뷰에서 ""최근 'SNL코리아' 출연도 화제가 됐다. '온 힘을 다 해 장가 안가려고 하는 것 같다'는 반응도 있더라""는 말에 ""저는 '예쁘다' 소리를 많이 들었다. '예쁜 줄 몰랐다'라는 후기가 많더라""며 웃더니 ""새로운 반응이라 좋았다""고 말했다.\n안재홍은 홍보 차 출연한 'SNL 코리아'에서 '아이돌 안젤'로 또 새로운 얼굴을 선보였다. 보라색 단발머리를 시그니처로, 'SNL' 크루들과 함께 잠재된 아이돌력을 마음껏 뽐낸 것.\n""'하이파이브'가 흥행에 성공하면 공약으로 다시 아이돌 분장을 해 볼 생각은 없냐""고 묻자 안재홍은 ""많은 사랑을 받는다면 안젤로 또 한번 인사 드려도 좋을 것 같다""며 ""큰 사랑 받고 싶다""고 강조했다. '큰 사랑의 기준'에 대해서는 ""수치는 다 좋다""면서도 ""600만 하겠다""고 화끈한 바람을 내비쳤다.\n안재홍은 넷플릭스 시리즈 '마스크 걸'의 파격 캐릭터를 기점으로 대중의 호감도와 신뢰도가 이전보다 더욱 수직 상승한 배우로 자리매김했다. 안재홍의 코미디는 무조건 믿고 보는 콘텐트가 됐고, 실망없는 만점 타율을 자랑 중이다.\n""배우로서는 부담이 될 것 같다""고 하자 안재홍은 ""오히려 가장 감사한 부분인 것 같다. 어떤 배우가 작품에 등장했을 때 '재미있겠다!'라는 기대감을 드릴 수 있다는 것이 어마어마하게 영광스러운 일이라는 생각을 많이 한다""고 고백했다.\n이어 ""그래서 부담이라기 보다는, 저라는 배우와 작품과 관객이 함께 쌓은 시간이 가져오는 마음인 것 같아서 굉장히 감사하고 엄청나게 영광스럽다""며 ""그런 의미에서 '하이파이브'라는 작품 역시 특히나, 특별하게도 그런 부분들이 순간 순간 자리하는 작품이 아닐까 싶어 기대하고 있다""고 밝혔다.\n30일 개봉하는 '하이파이브'는 장기이식으로 우연히 각기 다른 초능력을 얻게 된 다섯 명이 그들의 능력을 탐하는 자들과 만나 벌어지는 이야기를 그린 코믹 액션 활극이다. 안재홍은 극중 폐를 이식 받아 바람을 다스리는 지성으로 분해 믿고 보는 안재홍표 코믹 연기를 과감하게 선보인다.\n조연경 엔터뉴스팀 기자 cho.yeongyeong@jtbc.co.kr (콘텐트비즈니스본부)"
